{
  "schema_version": 1,
  "boot_id": "build:aiur-team/aiur:test-build",
  "generated_at": "2026-08-03T16:36:43.835713Z",
  "source_files": ["/home/everdred/code/aiur-workspaces/aiur-team/aiur/1459/analytics/tests/fixtures/session-a/telemetry.ndjson","/home/everdred/code/aiur-workspaces/aiur-team/aiur/1459/analytics/tests/fixtures/session-b/telemetry.ndjson"],
  "source_bytes": 8156,
  "records": [
    {"schema_version":2,"kind":"lifecycle","timestamp":"2026-07-11T00:00:03Z","timestamp_iso":"2026-07-11T00:00:03Z","timestamp_ms":1783728003000,"recorded_at":"2026-07-11T00:00:03Z","boot_id":"boot-a","sequence":4,"record_id":"boot-a:4","attributes":{"ticket":"930","attempt_id":"a1","event":"dispatch","boundary":"point","complexity":2,"backend":"codex","worker_host":"host-1","event_key":"dispatch-930"},"source_path":"/home/everdred/code/aiur-workspaces/aiur-team/aiur/1459/analytics/tests/fixtures/session-a/telemetry.ndjson","source_line":4},
    {"schema_version":2,"kind":"lifecycle","timestamp":"2026-07-11T00:00:04Z","timestamp_iso":"2026-07-11T00:00:04Z","timestamp_ms":1783728004000,"recorded_at":"2026-07-11T00:00:04Z","boot_id":"boot-a","sequence":5,"record_id":"boot-a:5","attributes":{"ticket":"930","attempt_id":"a1","event":"implement","boundary":"start","operation_id":"turn:1","backend":"codex","worker_host":"host-1","event_key":"impl-930-a-start"},"source_path":"/home/everdred/code/aiur-workspaces/aiur-team/aiur/1459/analytics/tests/fixtures/session-a/telemetry.ndjson","source_line":5},
    {"schema_version":2,"kind":"resource","timestamp":"2026-07-11T00:00:05Z","timestamp_iso":"2026-07-11T00:00:05Z","timestamp_ms":1783728005000,"recorded_at":"2026-07-11T00:00:05Z","boot_id":"boot-a","sequence":6,"record_id":"boot-a:6","attributes":{"actor":"ticket:930","actor_type":"agent","ticket":"930","availability":"measured","cpu_percent":50.0,"rss_bytes":200},"source_path":"/home/everdred/code/aiur-workspaces/aiur-team/aiur/1459/analytics/tests/fixtures/session-a/telemetry.ndjson","source_line":6},
    {"schema_version":2,"kind":"lifecycle","timestamp":"2026-07-11T00:00:06Z","timestamp_iso":"2026-07-11T00:00:06Z","timestamp_ms":1783728006000,"recorded_at":"2026-07-11T00:00:06Z","boot_id":"boot-a","sequence":7,"record_id":"boot-a:7","attributes":{"ticket":"930","attempt_id":"a1","event":"build_test","boundary":"start","operation_id":"cmd-1","command_class":"test","outcome":"pending","event_key":"build-930-1-start"},"source_path":"/home/everdred/code/aiur-workspaces/aiur-team/aiur/1459/analytics/tests/fixtures/session-a/telemetry.ndjson","source_line":7},
    {"schema_version":2,"kind":"resource","timestamp":"2026-07-11T00:00:07Z","timestamp_iso":"2026-07-11T00:00:07Z","timestamp_ms":1783728007000,"recorded_at":"2026-07-11T00:00:07Z","boot_id":"boot-a","sequence":8,"record_id":"boot-a:8","attributes":{"actor":"ticket:930","actor_type":"agent","ticket":"930","availability":"measured","cpu_percent":80.0,"rss_bytes":250},"source_path":"/home/everdred/code/aiur-workspaces/aiur-team/aiur/1459/analytics/tests/fixtures/session-a/telemetry.ndjson","source_line":8},
    {"schema_version":2,"kind":"lifecycle","timestamp":"2026-07-11T00:00:08Z","timestamp_iso":"2026-07-11T00:00:08Z","timestamp_ms":1783728008000,"recorded_at":"2026-07-11T00:00:08Z","boot_id":"boot-a","sequence":9,"record_id":"boot-a:9","attributes":{"ticket":"930","attempt_id":"a1","event":"build_test","boundary":"end","operation_id":"cmd-1","command_class":"test","outcome":"failed","event_key":"build-930-1-end"},"source_path":"/home/everdred/code/aiur-workspaces/aiur-team/aiur/1459/analytics/tests/fixtures/session-a/telemetry.ndjson","source_line":9},
    {"schema_version":2,"kind":"lifecycle","timestamp":"2026-07-11T00:00:09Z","timestamp_iso":"2026-07-11T00:00:09Z","timestamp_ms":1783728009000,"recorded_at":"2026-07-11T00:00:09Z","boot_id":"boot-a","sequence":10,"record_id":"boot-a:10","attributes":{"ticket":"930","attempt_id":"a1","event":"rework_start","boundary":"point","event_key":"rework-930"},"source_path":"/home/everdred/code/aiur-workspaces/aiur-team/aiur/1459/analytics/tests/fixtures/session-a/telemetry.ndjson","source_line":10},
    {"schema_version":2,"kind":"lifecycle","timestamp":"2026-07-11T00:00:10Z","timestamp_iso":"2026-07-11T00:00:10Z","timestamp_ms":1783728010000,"recorded_at":"2026-07-11T00:00:10Z","boot_id":"boot-a","sequence":11,"record_id":"boot-a:11","attributes":{"ticket":"930","attempt_id":"a1","event":"agent_resume","boundary":"point","event_key":"resume-930"},"source_path":"/home/everdred/code/aiur-workspaces/aiur-team/aiur/1459/analytics/tests/fixtures/session-a/telemetry.ndjson","source_line":11},
    {"schema_version":2,"kind":"lifecycle","timestamp":"2026-07-11T00:00:11Z","timestamp_iso":"2026-07-11T00:00:11Z","timestamp_ms":1783728011000,"recorded_at":"2026-07-11T00:00:11Z","boot_id":"boot-a","sequence":12,"record_id":"boot-a:12","attributes":{"ticket":"930","attempt_id":"a1","event":"implement","boundary":"end","operation_id":"turn:1","event_key":"impl-930-a-end"},"source_path":"/home/everdred/code/aiur-workspaces/aiur-team/aiur/1459/analytics/tests/fixtures/session-a/telemetry.ndjson","source_line":12},
    {"schema_version":2,"kind":"lifecycle","timestamp":"2026-07-11T00:00:12Z","timestamp_iso":"2026-07-11T00:00:12Z","timestamp_ms":1783728012000,"recorded_at":"2026-07-11T00:00:12Z","boot_id":"boot-a","sequence":13,"record_id":"boot-a:13","attributes":{"ticket":"930","attempt_id":"a1","event":"pr_opened","boundary":"point","source":"github","source_id":"pr:12:pr.opened","pr_number":12,"event_key":"pr-930-opened"},"source_path":"/home/everdred/code/aiur-workspaces/aiur-team/aiur/1459/analytics/tests/fixtures/session-a/telemetry.ndjson","source_line":13},
    {"schema_version":2,"kind":"lifecycle","timestamp":"2026-07-11T00:00:13Z","timestamp_iso":"2026-07-11T00:00:13Z","timestamp_ms":1783728013000,"recorded_at":"2026-07-11T00:00:13Z","boot_id":"boot-a","sequence":14,"record_id":"boot-a:14","attributes":{"ticket":"930","attempt_id":"a1","event":"pr_merged","boundary":"point","source":"github","source_id":"pr:12:pr.merged","pr_number":12,"event_key":"pr-930-merged"},"source_path":"/home/everdred/code/aiur-workspaces/aiur-team/aiur/1459/analytics/tests/fixtures/session-a/telemetry.ndjson","source_line":14},
    {"schema_version":2,"kind":"lifecycle","timestamp":"2026-07-11T00:00:14Z","timestamp_iso":"2026-07-11T00:00:14Z","timestamp_ms":1783728014000,"recorded_at":"2026-07-11T00:00:14Z","boot_id":"boot-a","sequence":15,"record_id":"boot-a:15","attributes":{"ticket":"931","attempt_id":"a2","event":"dispatch","boundary":"point","complexity":1,"event_key":"dispatch-931"},"source_path":"/home/everdred/code/aiur-workspaces/aiur-team/aiur/1459/analytics/tests/fixtures/session-a/telemetry.ndjson","source_line":15},
    {"schema_version":2,"kind":"lifecycle","timestamp":"2026-07-11T00:00:15Z","timestamp_iso":"2026-07-11T00:00:15Z","timestamp_ms":1783728015000,"recorded_at":"2026-07-11T00:00:15Z","boot_id":"boot-a","sequence":16,"record_id":"boot-a:16","attributes":{"ticket":"931","attempt_id":"a2","event":"implement","boundary":"start","operation_id":"turn:1","event_key":"impl-931-a-start"},"source_path":"/home/everdred/code/aiur-workspaces/aiur-team/aiur/1459/analytics/tests/fixtures/session-a/telemetry.ndjson","source_line":16},
    {"schema_version":2,"kind":"resource","timestamp":"2026-07-11T00:00:16Z","timestamp_iso":"2026-07-11T00:00:16Z","timestamp_ms":1783728016000,"recorded_at":"2026-07-11T00:00:16Z","boot_id":"boot-a","sequence":17,"record_id":"boot-a:17","attributes":{"actor":"ticket:931","actor_type":"agent","ticket":"931","availability":"measured","cpu_percent":20.0,"rss_bytes":150},"source_path":"/home/everdred/code/aiur-workspaces/aiur-team/aiur/1459/analytics/tests/fixtures/session-a/telemetry.ndjson","source_line":17},
    {"schema_version":2,"kind":"lifecycle","timestamp":"2026-07-11T01:00:02Z","timestamp_iso":"2026-07-11T01:00:02Z","timestamp_ms":1783731602000,"recorded_at":"2026-07-11T01:00:02Z","boot_id":"boot-b","sequence":2,"record_id":"boot-b:2","attributes":{"ticket":"930","attempt_id":"b1","event":"implement","boundary":"start","operation_id":"turn:1","backend":"claude","worker_host":"host-2","event_key":"impl-930-b-start"},"source_path":"/home/everdred/code/aiur-workspaces/aiur-team/aiur/1459/analytics/tests/fixtures/session-b/telemetry.ndjson","source_line":2},
    {"schema_version":2,"kind":"resource","timestamp":"2026-07-11T01:00:03Z","timestamp_iso":"2026-07-11T01:00:03Z","timestamp_ms":1783731603000,"recorded_at":"2026-07-11T01:00:03Z","boot_id":"boot-b","sequence":3,"record_id":"boot-b:3","attributes":{"actor":"ticket:930","actor_type":"agent","ticket":"930","availability":"measured","cpu_percent":60.0,"rss_bytes":300},"source_path":"/home/everdred/code/aiur-workspaces/aiur-team/aiur/1459/analytics/tests/fixtures/session-b/telemetry.ndjson","source_line":3},
    {"schema_version":2,"kind":"lifecycle","timestamp":"2026-07-11T01:00:04Z","timestamp_iso":"2026-07-11T01:00:04Z","timestamp_ms":1783731604000,"recorded_at":"2026-07-11T01:00:04Z","boot_id":"boot-b","sequence":4,"record_id":"boot-b:4","attributes":{"ticket":"930","attempt_id":"b1","event":"build_test","boundary":"start","operation_id":"cmd-1","command_class":"test","outcome":"pending","event_key":"build-930-b-start"},"source_path":"/home/everdred/code/aiur-workspaces/aiur-team/aiur/1459/analytics/tests/fixtures/session-b/telemetry.ndjson","source_line":4},